{
  "$schema": "./codex-crew-dispatch.schema.json",
  "schema_version": "codex-crew.dispatch.v0",
  "profile": "lite",
  "repository_root": "D:/CodeSpace/example-repository",
  "parent_run_id": "replace-with-parent-run-id",
  "parent_thread_id": "replace-with-parent-thread-id",
  "tasks": [
    {
      "id": "fix-null-guard",
      "prompt": "不改变既有接口或设计，修复已确认的空值错误。若需要改变范围、接口、权限、外部副作用或验收口径，返回 needs_parent 或 needs_owner。",
      "worktree": {"path": "D:/CodeSpace/example-repository-wt/fix-null-guard", "branch": "codex/fix-null-guard", "base_ref": "HEAD"},
      "verification_commands": ["python -m pytest tests/test_null_guard.py -q"]
    }
  ]
}
